{
  "$schema": "http://json-schema.org/draft-07/schema#",
  "$ref": "#/definitions/ElementalStoneMaterial",
  "definitions": {
    "ElementalStoneMaterial": {
      "type": "object",
      "properties": {
        "id": {
          "type": "string"
        },
        "name": {
          "type": "string"
        },
        "description": {
          "type": "string"
        },
        "source": {
          "type": "array",
          "items": {
            "type": "string"
          }
        },
        "rarity": {
          "type": "number"
        },
        "version": {
          "type": "string"
        }
      },
      "required": [
        "id",
        "name",
        "description",
        "source",
        "rarity",
        "version"
      ],
      "additionalProperties": false
    }
  }
}