{
  "id": "EverflameSeed",
  "name": "Ngọn Lửa Vĩnh Hằng",
  "description": "Dòng chảy năng lượng lưu chuyển sâu trong đại địa mang theo nguyện vọng vô tận, nương theo ngọn lửa thấm vào thực vật, khiến nó lúc nào cũng cháy rực và khao khát dùng hoa lửa tẩy sạch mọi thứ, đây là thứ nguyện vọng gì nhỉ.",
  "source": [
    "Cây Nổ cấp 30 trở lên rơi"
  ],
  "rarity": 4,
  "version": "5.0"
}