{
  "id": "ArtificedSpareClockworkComponentCoppelia",
  "name": "Componente meccanico di ricambio artificiale (Coppelia)",
  "description": "Secondo il progetto del suo creatore, la storia della Danzautoma dalle delicate giunture termina con un lieto fine. Su chiunque tenterà di disturbare quell'istante, Coppelia scaglierà sventura grazie alle sue impressionanti abilità di combattimento.",
  "source": [
    "Ottenibile da Suite del Vento glaciale di liv. 30+",
    "Ottenibile da Suite del Vento glaciale di liv. 30+"
  ],
  "rarity": 4,
  "version": "5.0"
}