{
  "id": "ChaosStorage",
  "name": "Chaos Storage",
  "description": "Ruin Drakes can absorb Elemental Energy from the outside and store it in this component inside their \"neck.\"",
  "source": [
    "Dropped by Ruin Drakes",
    "Stardust Exchange",
    "Dropped by Ruin Drakes",
    "Stardust Exchange"
  ],
  "rarity": 2,
  "version": "5.0"
}